[
  {
    "id": "2026-10-21-1",
    "date": "2026-10-21",
    "type": "diplomatic expression",
    "original": "That won't work.",
    "better": "I'm not sure that will get us there. Could we look at another option?",
    "notes": "Starter example. Replace or delete once real sessions are logged."
  },
  {
    "id": "2026-10-21-2",
    "date": "2026-10-21",
    "type": "rephrasing",
    "original": "I want to tell one thing.",
    "better": "There's one thing I'd like to add.",
    "notes": "Starter example. 'tell' needs an object (tell someone); use 'say' or 'add' here."
  }
]
